{"schema_version":1,"report_kind":"full","command":"check","execution_provenance":"windows-native","check_contract_ready":true,"projects_dir":"D:\\projects","offline":true,"overall":"action_required","exit_code":10,"authorizations":[],"plans":[{"action_id":"shell-tests.deferred","target":"host","required":true,"state":"blocked","blocked_by":["deferred"],"prerequisites":[],"credential_policy":"deny","network_policy":"deny","environment_profile":"tool-probe-v1","recovery":{"kind":"deferred","owner":"issue 08","affected":[],"instructions":"Define the successor contract.","verification":"Validate issue 08."}}],"results":[{"scope":"action","name":"shell-tests.deferred","required":true,"status":"action_required","code":"NPR-ACTION-DEFERRED","message":"Required action is deferred.","remediation":null}],"mutations":[],"diagnostics":[],"errors":[],"fallback":null}
