{"schema_version":1,"report_kind":"full","command":"setup","execution_provenance":"windows-native","check_contract_ready":true,"projects_dir":"D:\\projects","offline":true,"overall":"failed","exit_code":20,"authorizations":[],"plans":[{"action_id":"shell-tests.deferred","target":"host","required":true,"state":"blocked","blocked_by":["deferred"],"prerequisites":[],"credential_policy":"deny","network_policy":"deny","environment_profile":"tool-probe-v1","recovery":{"kind":"deferred","owner":"issue 08","affected":[],"instructions":"Define the successor contract.","verification":"Validate issue 08."}}],"results":[],"mutations":[{"action_id":"a.applied","state":"applied","targets":["target-a"],"recovery":{"kind":"exact","owner":"fixture","affected":["target-a"],"instructions":"Restore A.","verification":"Verify A."},"child_exit":0,"timed_out":false,"success_probe":"pass"},{"action_id":"b.failed","state":"failed","targets":["target-b"],"recovery":{"kind":"manual","owner":"fixture","affected":["target-b"],"instructions":"Inspect B.","verification":"Verify B."},"child_exit":1,"timed_out":false,"success_probe":"fail"},{"action_id":"c.partial","state":"partial","targets":["target-c"],"recovery":{"kind":"manual","owner":"fixture","affected":["target-c"],"instructions":"Inspect C.","verification":"Verify C."},"child_exit":null,"timed_out":true,"success_probe":"unknown"},{"action_id":"d.unknown","state":"unknown","targets":[],"recovery":{"kind":"manual","owner":"fixture","affected":[],"instructions":"Inspect unknown state.","verification":"Verify state."},"child_exit":null,"timed_out":false,"success_probe":"not_run"}],"diagnostics":[{"code":"NPR-DIAGNOSTIC","message":"Sanitized fixture diagnostic."}],"errors":[],"fallback":null}
